{
  "botRisk": "med",
  "budget": { "minutes": 15, "tools": 80, "turns": 30 },
  "checks": [
    {
      "blockedBy": "Reincarnation 20608 is dropped at login (Player::_LoadSpells, CheckSkillLearnedBySpell) for a non-Shaman, and no Shaman preset or Warlock partner exists, so the character has no PLAYER_SELF_RES_SPELL and recover how:self refuses no_self_res",
      "evidence": { "truth": ["alive"] },
      "expect": "T final alive is true and T final deathState is alive",
      "id": "alive",
      "source": "truth"
    },
    {
      "blockedBy": "Reincarnation 20608 is dropped at login (Player::_LoadSpells, CheckSkillLearnedBySpell) for a non-Shaman, and no Shaman preset or Warlock partner exists, so the character has no PLAYER_SELF_RES_SPELL and recover how:self refuses no_self_res",
      "evidence": { "events": ["life/dead", "life/alive"] },
      "expect": "GL has life/dead then life/alive with no life/released between, so the character came back in place without a corpse walk",
      "id": "no-corpse-walk",
      "source": "game_log"
    },
    {
      "blockedBy": "Reincarnation 20608 is dropped at login (Player::_LoadSpells, CheckSkillLearnedBySpell) for a non-Shaman, and no Shaman preset or Warlock partner exists, so the character has no PLAYER_SELF_RES_SPELL and recover how:self refuses no_self_res",
      "evidence": { "events": ["life/dead", "life/alive"] },
      "expect": "the GL pose at life/alive is within 5 yd of the GL pose at life/dead, so the resurrection happened where the character died",
      "id": "self-res-in-place",
      "source": "game_log"
    }
  ],
  "field": "fairbreeze-stalkers",
  "id": "t6-selfstate-res",
  "navBound": true,
  "needsWatcher": false,
  "paneMinutes": 18,
  "partner": null,
  "preset": "fresh",
  "setup": [
    {
      "body": {
        "map": 530,
        "o": 1.686,
        "x": 8751,
        "y": -6685,
        "z": 69.26,
        "zone": 3430
      },
      "endpoint": "position"
    },
    { "body": { "spell": 20608 }, "endpoint": "spells/learn" },
    { "body": { "count": 1, "item": 17030 }, "endpoint": "items/add" }
  ],
  "steers": [
    {
      "at": { "kind": "trigger", "trigger": "death" },
      "text": "You died. Come back to life where you died without walking back to your body. Use recover with how self."
    }
  ],
  "task": "Head northeast out of the village and fight the first big cat you see. When you die, come back to life where you died without walking back to your body.",
  "tier": 6
}
