{
  "botRisk": "low",
  "budget": {
    "minutes": 8,
    "tools": 18,
    "turns": 10
  },
  "checks": [
    {
      "evidence": {
        "items": [43395],
        "truth": ["inventory"]
      },
      "expect": "T final has no row of item 43395 (Glyph of Battle): the single glyph from the setup is consumed by the apply",
      "id": "used",
      "source": "truth"
    },
    {
      "evidence": {
        "events": ["talents/glyph"]
      },
      "expect": "GL has a talents/glyph row with the glyph in a slot, then a talents/glyph row with that slot cleared: the agent put the glyph in and took it out again",
      "id": "slots",
      "source": "game_log"
    }
  ],
  "id": "t8-talents-glyph",
  "navBound": false,
  "needsWatcher": false,
  "paneMinutes": 11,
  "partner": null,
  "preset": "eversong10-warrior",
  "setup": [
    {
      "body": {
        "level": 15
      },
      "endpoint": "level"
    },
    {
      "body": {
        "count": 1,
        "item": 43395
      },
      "endpoint": "items/add"
    }
  ],
  "spawn": "eversong-glyph",
  "steers": [],
  "task": "Put your glyph in a glyph slot, then take it out again.",
  "tier": 8
}
