{
  "botRisk": "low",
  "budget": {
    "minutes": 8,
    "tools": 16,
    "turns": 8
  },
  "checks": [
    {
      "evidence": {
        "events": ["arena/queue"]
      },
      "expect": "GL has an arena/queue row: the server confirmed the skirmish queue",
      "id": "queued",
      "source": "game_log"
    },
    {
      "evidence": {
        "events": ["arena/queue_left"]
      },
      "expect": "GL has an arena/queue_left row after the arena/queue row: the queue emptied",
      "id": "queue-emptied",
      "source": "game_log"
    },
    {
      "expect": "the session shows the agent calling the arena tool with do queue and action join (2v2, not rated), not ending REFUSED",
      "id": "join-called",
      "source": "session"
    },
    {
      "expect": "the session shows the agent calling the arena tool with do queue and action leave, not ending REFUSED",
      "id": "leave-called",
      "source": "session"
    },
    {
      "expect": "the agent's answer says it joined the 2v2 skirmish queue and then left it",
      "id": "answer-reports",
      "source": "session"
    }
  ],
  "id": "t9-arena-skirmish",
  "navBound": false,
  "needsWatcher": false,
  "paneMinutes": 11,
  "partner": null,
  "preset": "max80",
  "setup": [
    {
      "body": {
        "map": 1,
        "o": 1.5,
        "x": 1035.6,
        "y": -2106,
        "z": 122.9,
        "zone": 17
      },
      "endpoint": "position"
    }
  ],
  "steers": [],
  "task": "You are not in an arena team. Find the battlemaster next to you and join the unrated 2v2 arena skirmish queue, confirm you are queued, then leave the queue. Tell me whether you were queued and whether you left.",
  "tier": 9
}
