{
  "botRisk": "med",
  "budget": {
    "minutes": 4,
    "tools": 10,
    "turns": 5
  },
  "checks": [
    {
      "expect": "every creature named as hostile is one of the hostile types near Fairbreeze: Springpaw Stalker, Eversong Tender, Rotlimb Cannibal or Plaguebone Pillager; a name on neither list is recorded as unverifiable in observed and the check is decided on the listed names only",
      "id": "hostile-names",
      "source": "game_log"
    },
    {
      "expect": "no Crazed Dragonhawk, Feral Dragonhawk Hatchling, Red Dragonhawk Hatchling, Golden Dragonhawk Hatchling or Silver Dragonhawk Hatchling is called hostile (they are neutral)",
      "id": "neutral-not-hostile",
      "source": "game_log"
    },
    {
      "expect": "the stated distance of the closest one is within 25% of the GL distance at the answer time; nothing within range is correct if GL shows none within 60 yd",
      "id": "closest-distance",
      "source": "game_log"
    }
  ],
  "id": "t0-hostiles",
  "navBound": false,
  "needsWatcher": false,
  "paneMinutes": 7,
  "partner": null,
  "preset": "eversong10",
  "setup": [],
  "steers": [],
  "task": "Is anything near you hostile? What's the closest one and roughly how far?",
  "tier": 0
}
